{
  "$schema": "https://json-schema.org/draft/2020-12/schema",
  "title": "routes-v1",
  "description": "Meta-schema for routes-v1.json — the declarative route flow-shape manifest. 文件本身无运行时 validator 加载（与仓库其他 schema 一致，作为结构契约文档）；test_routes_manifest.sh 用 jq 做实际结构校验。",
  "type": "object",
  "required": ["schema_version", "global_transitions", "routes"],
  "properties": {
    "schema_version": { "type": "string", "const": "1" },
    "description": { "type": "string" },
    "global_transitions": {
      "type": "array",
      "description": "route-无关的 work-item 状态机转换，格式 'actor:from:to'，* 通配。对所有 route 生效。",
      "items": { "type": "string", "pattern": "^[A-Za-z*-]+:[A-Za-z*_-]+:[A-Za-z*_-]+$" },
      "minItems": 1
    },
    "routes": {
      "type": "object",
      "description": "每个 route 一条记录，键为 route 名（须覆盖 workflow-state-v1.json route enum 的全部值）。",
      "additionalProperties": {
        "type": "object",
        "required": ["phases", "phase_transitions", "gate_exemptions", "dispatch_shape", "budget", "commit_format"],
        "properties": {
          "phases": {
            "type": "array",
            "description": "本 route 实际经过的 phase 有序序列。",
            "items": { "type": "string" }
          },
          "phase_transitions": {
            "type": "array",
            "description": "本 route 合法的 phase 推进，格式 'Coordinator:from:to'。轻档不含 workflow:discovery 即机器拦截误跳。",
            "items": { "type": "string", "pattern": "^[A-Za-z*-]+:[A-Za-z*_-]+:[A-Za-z*_-]+$" }
          },
          "gate_exemptions": {
            "type": "array",
            "description": "本 route 豁免的 gate 名（取代假 phase_skip）。",
            "items": { "type": "string", "enum": ["discovery", "plan-writing", "plan-review", "execution", "final-review"] }
          },
          "dispatch_shape": {
            "type": "object",
            "description": "phase→派发形态。取代 validate-plan-dispatch / dispatch-route-worker / validate-pack-manifest 的 phase 字面量。",
            "additionalProperties": { "type": "string", "enum": ["plan-level", "route-worker"] }
          },
          "budget": {
            "type": "object",
            "required": ["init"],
            "properties": {
              "init": { "type": "string", "enum": ["pending_plan_count", "unlimited"] },
              "formula": { "type": ["string", "null"], "description": "仅 init=pending_plan_count 时有意义；公式参数化交由 04 分册（P4）。" }
            }
          },
          "commit_format": {
            "type": ["string", "null"],
            "description": "取代假 commit_format_override。如 hotfix 子变体用 'hotfix-unreviewed'。"
          }
        }
      }
    }
  }
}
